{"artifacts":[{"digest":{"algorithm":"sha-256","value":"6e6e3c15b1ca8cc85b1148618aeb5c9aa2ba25fac978ebced5fff76c07d7ddf9"},"mediaType":"application/json","path":"objects/evaluator-manifest.json","requiredForVerification":true,"role":"EVALUATOR_MANIFEST","sizeBytes":1428},{"digest":{"algorithm":"sha-256","value":"61fea8d71334ebe2e41d21a273a04a8bec76931fbe9a95fa017036d0f32dfc49"},"mediaType":"application/json","path":"objects/profile-definition.json","requiredForVerification":true,"role":"PROFILE_DEFINITION","sizeBytes":2051},{"digest":{"algorithm":"sha-256","value":"47f02dd4b3e00bea3537ad554a5cbcece62ad2b37cde6a9c53eb7c8840a6976f"},"mediaType":"application/json","path":"objects/evaluation-request.json","requiredForVerification":true,"role":"EVALUATION_REQUEST","sizeBytes":2708},{"digest":{"algorithm":"sha-256","value":"51da81a2ae2d39ed92a82004205aa9faf4929c0750a9f24df8c04b3e668e0732"},"mediaType":"application/json","path":"objects/evidence-bundle.json","requiredForVerification":true,"role":"EVIDENCE_BUNDLE","sizeBytes":2130},{"digest":{"algorithm":"sha-256","value":"193b40cf14eb6c09ff10b213dea61560a4078d86f690658da8a32dc7b7d20fb1"},"mediaType":"application/json","path":"objects/evaluation-attestation.json","requiredForVerification":true,"role":"EVALUATION_ATTESTATION","sizeBytes":3199},{"digest":{"algorithm":"sha-256","value":"f911b962ff89233ef3dd9e908ab1be39d9615016835995f71b97d20fe9714baa"},"mediaType":"application/json","path":"evidence/deliverable.json","requiredForVerification":true,"role":"SOURCE_ARTIFACT","sizeBytes":248},{"digest":{"algorithm":"sha-256","value":"11a39e270ae164b77ae6c7054baae2b0592921be17a3c3449281b36e1aa3111f"},"mediaType":"application/schema+json","path":"evidence/deliverable.schema.json","requiredForVerification":true,"role":"SOURCE_ARTIFACT","sizeBytes":787},{"digest":{"algorithm":"sha-256","value":"071afa7d931d34d01f9685badf106ede445ca13370749cbf2e0cf980adac14b7"},"mediaType":"text/markdown","path":"reports/summary.md","requiredForVerification":false,"role":"HUMAN_REPORT","sizeBytes":1203}],"bindings":{"attestationDigest":{"algorithm":"sha-256","value":"193b40cf14eb6c09ff10b213dea61560a4078d86f690658da8a32dc7b7d20fb1"},"evidenceBundleDigest":{"algorithm":"sha-256","value":"51da81a2ae2d39ed92a82004205aa9faf4929c0750a9f24df8c04b3e668e0732"},"manifestDigest":{"algorithm":"sha-256","value":"6e6e3c15b1ca8cc85b1148618aeb5c9aa2ba25fac978ebced5fff76c07d7ddf9"},"profileDigest":{"algorithm":"sha-256","value":"61fea8d71334ebe2e41d21a273a04a8bec76931fbe9a95fa017036d0f32dfc49"},"requestDigest":{"algorithm":"sha-256","value":"47f02dd4b3e00bea3537ad554a5cbcece62ad2b37cde6a9c53eb7c8840a6976f"}},"classification":"INTERNAL_REFERENCE","dossierId":"dossier.formal.reference.001","economicAction":"OUT_OF_SCOPE","exporter":{"id":"evaldossier.fixture.exporter","key":{"alg":"EdDSA","crv":"Ed25519","kid":"8IpKNONPDNo-6rI1IZrWZO1D_fv2S7NGxdJ4MVD2-3o","kty":"OKP","use":"sig","x":"Mz62MFzmZBlsRtwJx8sKtbCMyWS0IzVnzgzddM_eRdI"}},"generatedAt":"2026-07-21T12:00:10Z","proof":{"jws":"eyJhbGciOiJFZERTQSIsImtpZCI6IjhJcEtOT05QRE5vLTZySTFJWnJXWk8xRF9mdjJTN05HeGRKNE1WRDItM28iLCJ0eXAiOiJldmFsZG9zc2llci5kb3NzaWVyLzAuMSJ9..FuPoj2yMV0IwpHH4iDNiJCiPZjSEqHhA-wbo5TZLbQNjcW4bY1yMyVZ6MxqanV5D3EWznvfXqv9KIwdV649KBg","type":"evaldossier.detached-jws/0.1"},"protocolVersion":"evaldossier/0.1","schemaVersion":"evaldossier.dossier/0.1","signatureContext":{"audience":"evaldossier.demo.consumer","nonce":"Zm9ybWFsLWRvc3NpZXItbm9uY2U"},"signingKeyId":"8IpKNONPDNo-6rI1IZrWZO1D_fv2S7NGxdJ4MVD2-3o","warnings":["Fixture keys establish demo key control only; no institutional identity or trust is pinned."]}