{"artifacts":[{"digest":{"algorithm":"sha-256","value":"a4301beb2ccde18a4e143c71b4665851aa2cd176892e4fcade21047fa70e357f"},"mediaType":"application/json","path":"objects/evaluator-manifest.json","requiredForVerification":true,"role":"EVALUATOR_MANIFEST","sizeBytes":1428},{"digest":{"algorithm":"sha-256","value":"57e50c3fbd00ae371d6bf60b192bf0d739c092bcdb4011330a0198a9a79b792a"},"mediaType":"application/json","path":"objects/profile-definition.json","requiredForVerification":true,"role":"PROFILE_DEFINITION","sizeBytes":2051},{"digest":{"algorithm":"sha-256","value":"de46af8934fbad472902ab87f190eb43f1b4bbc659241196de7e80a35cfdee7c"},"mediaType":"application/json","path":"objects/evaluation-request.json","requiredForVerification":true,"role":"EVALUATION_REQUEST","sizeBytes":2708},{"digest":{"algorithm":"sha-256","value":"1f7581d3b3cfed403f9ae5172aabc3adb1caee2dc93ad2d725cb4f07fb655e4d"},"mediaType":"application/json","path":"objects/evidence-bundle.json","requiredForVerification":true,"role":"EVIDENCE_BUNDLE","sizeBytes":2130},{"digest":{"algorithm":"sha-256","value":"ced167eeabb3cf8cb9f5d2e3fedafbb4d44fc6e4232408b358c2ff14fbd4b83b"},"mediaType":"application/json","path":"objects/evaluation-attestation.json","requiredForVerification":true,"role":"EVALUATION_ATTESTATION","sizeBytes":3199},{"digest":{"algorithm":"sha-256","value":"f911b962ff89233ef3dd9e908ab1be39d9615016835995f71b97d20fe9714baa"},"mediaType":"application/json","path":"evidence/deliverable.json","requiredForVerification":true,"role":"SOURCE_ARTIFACT","sizeBytes":248},{"digest":{"algorithm":"sha-256","value":"11a39e270ae164b77ae6c7054baae2b0592921be17a3c3449281b36e1aa3111f"},"mediaType":"application/schema+json","path":"evidence/deliverable.schema.json","requiredForVerification":true,"role":"SOURCE_ARTIFACT","sizeBytes":787},{"digest":{"algorithm":"sha-256","value":"071afa7d931d34d01f9685badf106ede445ca13370749cbf2e0cf980adac14b7"},"mediaType":"text/markdown","path":"reports/summary.md","requiredForVerification":false,"role":"HUMAN_REPORT","sizeBytes":1203}],"bindings":{"attestationDigest":{"algorithm":"sha-256","value":"ced167eeabb3cf8cb9f5d2e3fedafbb4d44fc6e4232408b358c2ff14fbd4b83b"},"evidenceBundleDigest":{"algorithm":"sha-256","value":"1f7581d3b3cfed403f9ae5172aabc3adb1caee2dc93ad2d725cb4f07fb655e4d"},"manifestDigest":{"algorithm":"sha-256","value":"a4301beb2ccde18a4e143c71b4665851aa2cd176892e4fcade21047fa70e357f"},"profileDigest":{"algorithm":"sha-256","value":"57e50c3fbd00ae371d6bf60b192bf0d739c092bcdb4011330a0198a9a79b792a"},"requestDigest":{"algorithm":"sha-256","value":"de46af8934fbad472902ab87f190eb43f1b4bbc659241196de7e80a35cfdee7c"}},"classification":"INTERNAL_REFERENCE","dossierId":"openclaw.skill.reference.conformance.001","economicAction":"OUT_OF_SCOPE","exporter":{"id":"evaldossier.fixture.exporter","key":{"alg":"EdDSA","crv":"Ed25519","kid":"f6_U8X-uPcjFdvkVeY_kmvCp1IxdfYMRchOYaTQymxI","kty":"OKP","use":"sig","x":"2UxjiDSy-qUvXPhvezm7FPRHdEoa6F-mQh8jx6h72W8"}},"generatedAt":"2026-07-21T12:00:10Z","proof":{"jws":"eyJhbGciOiJFZERTQSIsImtpZCI6ImY2X1U4WC11UGNqRmR2a1ZlWV9rbXZDcDFJeGRmWU1SY2hPWWFUUXlteEkiLCJ0eXAiOiJldmFsZG9zc2llci5kb3NzaWVyLzAuMSJ9..aOMnNgOtTVlT_S0CUxcwymOKXO8iUTqeGxfMfJlg7pZu0aONtgefltdnbBOWr4Yj7YfTxAdHoPwuuA2AaTMgBg","type":"evaldossier.detached-jws/0.1"},"protocolVersion":"evaldossier/0.1","schemaVersion":"evaldossier.dossier/0.1","signatureContext":{"audience":"evaldossier.openclaw.skill.example","nonce":"b3BlbmNsYXctc2tpbGwtcmVmZXJlbmNlLW5vbmNlLTAwMQ"},"signingKeyId":"f6_U8X-uPcjFdvkVeY_kmvCp1IxdfYMRchOYaTQymxI","warnings":["This dossier was generated by the local OpenClaw Skill conformance path with ephemeral synthetic keys.","Ephemeral test-key control establishes no institutional identity, trust, authority, or production readiness."]}