{"artifacts":[{"digest":{"algorithm":"sha-256","value":"35fff9b3e214b686dcdcba8ec35768303ee51651c02b6776277be26fe61ffd06"},"mediaType":"application/json","path":"objects/evaluator-manifest.json","requiredForVerification":true,"role":"EVALUATOR_MANIFEST","sizeBytes":1476},{"digest":{"algorithm":"sha-256","value":"44ac90c7f4de6e5e26d8641bfb7ac68fc2cf70115987edfe6ed1fe834ec6ec2c"},"mediaType":"application/json","path":"objects/profile-definition.json","requiredForVerification":true,"role":"PROFILE_DEFINITION","sizeBytes":1994},{"digest":{"algorithm":"sha-256","value":"027dea87824cf0d1b8d20e9eefa96b9e5785dcc4cdb1365c26c8fcd4e565b03c"},"mediaType":"application/json","path":"objects/evaluation-request.json","requiredForVerification":true,"role":"EVALUATION_REQUEST","sizeBytes":3471},{"digest":{"algorithm":"sha-256","value":"559b3fc415dbac1eaf5fb26dee748b8bd9aa3a71adb53b4c83453bc39adf52fa"},"mediaType":"application/json","path":"objects/evidence-bundle.json","requiredForVerification":true,"role":"EVIDENCE_BUNDLE","sizeBytes":2721},{"digest":{"algorithm":"sha-256","value":"09f58f044d51fd0b133fe9b60f574892d57709caeb124cb8b23165e9d5dd3919"},"mediaType":"application/json","path":"objects/evaluation-attestation.json","requiredForVerification":true,"role":"EVALUATION_ATTESTATION","sizeBytes":5808},{"digest":{"algorithm":"sha-256","value":"48b4187cab1d88d71b73e51d368bb1396b0b5a2b992be8f943238a7f56fcd1ad"},"mediaType":"application/json","path":"evidence/model-request.json","requiredForVerification":true,"role":"SOURCE_ARTIFACT","sizeBytes":410},{"digest":{"algorithm":"sha-256","value":"70dc12ef30e529fe011bea434722cf0382c38ab19bc374f77a2e13f499fd0ca7"},"mediaType":"application/json","path":"evidence/model-response.json","requiredForVerification":true,"role":"SOURCE_ARTIFACT","sizeBytes":1445},{"digest":{"algorithm":"sha-256","value":"ceae88238630ead210843c52c24cc4ae0af1a34d432e62df11889db3fe804ef9"},"mediaType":"application/json","path":"evidence/model-rubric.json","requiredForVerification":true,"role":"SOURCE_ARTIFACT","sizeBytes":412},{"digest":{"algorithm":"sha-256","value":"ad171f372ed6a4ad9e40e9e6d08268f9bc26694d954d9164504eed6023faffec"},"mediaType":"text/markdown","path":"reports/summary.md","requiredForVerification":false,"role":"HUMAN_REPORT","sizeBytes":1136}],"bindings":{"attestationDigest":{"algorithm":"sha-256","value":"09f58f044d51fd0b133fe9b60f574892d57709caeb124cb8b23165e9d5dd3919"},"evidenceBundleDigest":{"algorithm":"sha-256","value":"559b3fc415dbac1eaf5fb26dee748b8bd9aa3a71adb53b4c83453bc39adf52fa"},"manifestDigest":{"algorithm":"sha-256","value":"35fff9b3e214b686dcdcba8ec35768303ee51651c02b6776277be26fe61ffd06"},"profileDigest":{"algorithm":"sha-256","value":"44ac90c7f4de6e5e26d8641bfb7ac68fc2cf70115987edfe6ed1fe834ec6ec2c"},"requestDigest":{"algorithm":"sha-256","value":"027dea87824cf0d1b8d20e9eefa96b9e5785dcc4cdb1365c26c8fcd4e565b03c"}},"classification":"INTERNAL_REFERENCE","dossierId":"dossier.synthetic.model-judgment.001","economicAction":"OUT_OF_SCOPE","exporter":{"id":"evaldossier.fixture.exporter","key":{"alg":"EdDSA","crv":"Ed25519","kid":"8IpKNONPDNo-6rI1IZrWZO1D_fv2S7NGxdJ4MVD2-3o","kty":"OKP","use":"sig","x":"Mz62MFzmZBlsRtwJx8sKtbCMyWS0IzVnzgzddM_eRdI"}},"generatedAt":"2026-07-21T12:10:20Z","proof":{"jws":"eyJhbGciOiJFZERTQSIsImtpZCI6IjhJcEtOT05QRE5vLTZySTFJWnJXWk8xRF9mdjJTN05HeGRKNE1WRDItM28iLCJ0eXAiOiJldmFsZG9zc2llci5kb3NzaWVyLzAuMSJ9..UvZKrcHarsMVDrdQ0Q2yseF7zteUGZUlm4SWImkIGxqUldtMUQBFKvHF71m4n6upWEslGMWolERl6P2dbXpHBg","type":"evaldossier.detached-jws/0.1"},"protocolVersion":"evaldossier/0.1","schemaVersion":"evaldossier.dossier/0.1","signatureContext":{"audience":"evaldossier.demo.consumer","nonce":"synthetic-model-judgment-nonce-0001"},"signingKeyId":"8IpKNONPDNo-6rI1IZrWZO1D_fv2S7NGxdJ4MVD2-3o","warnings":["This model-judgment fixture is project-authored synthetic data and represents no external provider or production event.","A favorable synthetic model judgment remains UNDETERMINED without an eligible evidentiary basis.","Synthetic payout fields remain ignored source data and are never mapped to an economic action."]}